{
  "$schema": "http://json-schema.org/draft-07/schema#",
  "$id": "https://jkolantree.github.io/astra/schemas/external-link-observations-v1.schema.json",
  "title": "External link transport observations v1",
  "type": "object",
  "additionalProperties": false,
  "required": ["schema", "scope", "generated_at", "policy", "observations"],
  "properties": {
    "schema": {"const": "https://jkolantree.github.io/astra/schemas/external-link-observations-v1.schema.json"},
    "scope": {"const": "dark-medium-response-atlas-v0.1.0"},
    "generated_at": {"type": ["string", "null"], "format": "date-time"},
    "policy": {
      "type": "object",
      "additionalProperties": false,
      "required": ["definite_missing_statuses", "transport_unresolved_statuses", "network_errors_are_not_dead_links", "canonical_doi_is_retained_when_publisher_transport_is_blocked"],
      "properties": {
        "definite_missing_statuses": {"const": [404, 410]},
        "transport_unresolved_statuses": {"const": [401, 403, 429, 451]},
        "network_errors_are_not_dead_links": {"const": true},
        "canonical_doi_is_retained_when_publisher_transport_is_blocked": {"const": true}
      }
    },
    "observations": {
      "type": "array",
      "minItems": 1,
      "items": {
        "type": "object",
        "additionalProperties": false,
        "required": ["url", "checked_at", "outcome"],
        "properties": {
          "url": {"type": "string", "format": "uri"},
          "checked_at": {"type": ["string", "null"], "format": "date-time"},
          "outcome": {"enum": ["not_checked", "http_ok", "redirect_ok", "transport_unresolved", "network_unresolved", "missing"]},
          "status": {"type": ["integer", "null"], "minimum": 100, "maximum": 599},
          "final_url": {"type": ["string", "null"], "format": "uri"},
          "detail": {"type": "string"}
        }
      }
    }
  }
}
